{
  "$schema": "https://json-schema.org/draft/2020-12/schema",
  "$id": "https://gravityinnovations.github.io/explore-ai/schemas/runtime.schema.json",
  "title": "Runtime",
  "type": "object",
  "properties": {
    "schemaVersion": {
      "$ref": "common.schema.json#/$defs/version"
    },
    "actions": {
      "type": "array",
      "items": {
        "$ref": "common.schema.json#/$defs/actionName"
      },
      "minItems": 0,
      "uniqueItems": true
    },
    "cameraModes": {
      "type": "array",
      "items": {
        "$ref": "common.schema.json#/$defs/cameraMode"
      },
      "minItems": 1,
      "uniqueItems": true
    },
    "components": {
      "type": "array",
      "items": {
        "type": "object",
        "properties": {
          "id": {
            "$ref": "common.schema.json#/$defs/slug"
          },
          "actions": {
            "type": "array",
            "items": {
              "$ref": "common.schema.json#/$defs/actionName"
            },
            "minItems": 0,
            "uniqueItems": true
          }
        },
        "required": [
          "id",
          "actions"
        ],
        "additionalProperties": false
      },
      "minItems": 0
    }
  },
  "required": [
    "schemaVersion",
    "actions",
    "cameraModes",
    "components"
  ],
  "additionalProperties": false
}
